song,artist,lyrics
Perfect,Ed Sheeran,"I found a love for me, darling just dive right in...,romantic"
Happier,Marshmello,"Lately, I've been thinking, I want you to be happier...,sad"
Can't Stop the Feeling!,Justin Timberlake,"I got this feeling inside my bones...,happy"
Let Her Go,Passenger,"Well you only need the light when it's burning low...,sad"
Thunder,Imagine Dragons,"Just a young gun with a quick fuse...,energetic"
All of Me,John Legend,"What would I do without your smart mouth...,romantic"
